{
  "schema_version": "chem-lab.verification-result.v2",
  "artifact_type": "verification_result",
  "slug": "lab-pin-dien-hoa-zn-cu",
  "html_file": "/home/ding/debug_mc/material_creator/skills_material_K12/skills/chemistry-experiment-lab/outputs/lab-pin-dien-hoa-zn-cu.html",
  "final_status": "pass",
  "blockers": [],
  "warnings": [],
  "verification": {
    "environment": {
      "browser": "chromium",
      "headless": true,
      "os": "linux",
      "viewport": "desktop-1280x800 + mobile-iPhone13"
    },
    "webgl": {
      "supported": true,
      "renderer_type": "ANGLE (Google, Vulkan 1.3.0 (SwiftShader Device (Subzero) (0x0000C0DE)), SwiftShader driver)",
      "fallback_used": true
    },
    "invariants": {
      "stage_present": true,
      "stage_dominance_pass": true,
      "autoplay_or_primary_run_pass": true,
      "mobile_fit_pass": true,
      "fallback_present": false
    }
  },
  "artifacts": {
    "desktop_screenshot": "/home/ding/debug_mc/material_creator/skills_material_K12/skills/chemistry-experiment-lab/evaluations/artifacts/lab-pin-dien-hoa-zn-cu/2026-06-20T12-41-57Z/desktop.png",
    "mobile_screenshot": "/home/ding/debug_mc/material_creator/skills_material_K12/skills/chemistry-experiment-lab/evaluations/artifacts/lab-pin-dien-hoa-zn-cu/2026-06-20T12-41-57Z/mobile.png",
    "trace": "/home/ding/debug_mc/material_creator/skills_material_K12/skills/chemistry-experiment-lab/evaluations/artifacts/lab-pin-dien-hoa-zn-cu/2026-06-20T12-41-57Z"
  },
  "checks": {
    "desktop": {
      "title": "Pin điện hóa Zn-Cu (Daniell cell)",
      "stagePresent": true,
      "stageAreaRatio": 0.5537875576019287,
      "scrollWidth": 1280,
      "innerWidth": 1280,
      "fallbackPresent": false,
      "primaryRunControlPresent": true,
      "buttonTexts": [
        "Khóa dự đoán và chạy",
        "Tạm dừng",
        "Làm lại",
        "Zn → Cu",
        "Cu → Zn",
        "Zn",
        "Cu",
        "Cu",
        "Zn"
      ]
    },
    "mobile": {
      "title": "Pin điện hóa Zn-Cu (Daniell cell)",
      "stagePresent": true,
      "stageAreaRatio": 0.6424930491195552,
      "scrollWidth": 390,
      "innerWidth": 390,
      "fallbackPresent": false,
      "primaryRunControlPresent": true,
      "buttonTexts": [
        "Khóa dự đoán và chạy",
        "Tạm dừng",
        "Làm lại",
        "Zn → Cu",
        "Cu → Zn",
        "Zn",
        "Cu",
        "Cu",
        "Zn"
      ]
    }
  },
  "created_at": "2026-06-20T12:42:07.513Z"
}