{
  "schema_version": "chem-lab.verification-result.v2",
  "artifact_type": "verification_result",
  "slug": "lab-can-bang-fescn",
  "html_file": "/home/ding/debug_mc/material_creator/skills_material_K12/skills/chemistry-experiment-lab/outputs/lab-can-bang-fescn.html",
  "final_status": "pass",
  "blockers": [],
  "warnings": [],
  "verification": {
    "environment": {
      "browser": "chromium",
      "headless": true,
      "os": "linux",
      "viewport": "desktop-1280x800 + mobile-iPhone13"
    },
    "webgl": {
      "supported": true,
      "renderer_type": "ANGLE (Google, Vulkan 1.3.0 (SwiftShader Device (Subzero) (0x0000C0DE)), SwiftShader driver)",
      "fallback_used": true
    },
    "invariants": {
      "stage_present": true,
      "stage_dominance_pass": true,
      "autoplay_or_primary_run_pass": true,
      "mobile_fit_pass": true,
      "fallback_present": false
    }
  },
  "artifacts": {
    "desktop_screenshot": "/home/ding/debug_mc/material_creator/skills_material_K12/skills/chemistry-experiment-lab/evaluations/artifacts/lab-can-bang-fescn/2026-06-19T20-32-52Z/desktop.png",
    "mobile_screenshot": "/home/ding/debug_mc/material_creator/skills_material_K12/skills/chemistry-experiment-lab/evaluations/artifacts/lab-can-bang-fescn/2026-06-19T20-32-52Z/mobile.png",
    "trace": "/home/ding/debug_mc/material_creator/skills_material_K12/skills/chemistry-experiment-lab/evaluations/artifacts/lab-can-bang-fescn/2026-06-19T20-32-52Z"
  },
  "checks": {
    "desktop": {
      "title": "Cân bằng Fe³⁺ + SCN⁻ ⇌ FeSCN²⁺",
      "stagePresent": true,
      "stageAreaRatio": 0.6873082995414734,
      "scrollWidth": 1280,
      "innerWidth": 1280,
      "fallbackPresent": false,
      "primaryRunControlPresent": true,
      "buttonTexts": [
        "Tạm dừng",
        "Chạy demo",
        "Chạy lại",
        "Thêm Fe3+",
        "Thêm SCN-",
        "Thêm nước",
        "Đến lúc trộn",
        "Đến kết quả"
      ]
    },
    "mobile": {
      "title": "Cân bằng Fe³⁺ + SCN⁻ ⇌ FeSCN²⁺",
      "stagePresent": true,
      "stageAreaRatio": 0.7682576459684893,
      "scrollWidth": 390,
      "innerWidth": 390,
      "fallbackPresent": false,
      "primaryRunControlPresent": true,
      "buttonTexts": [
        "Tạm dừng",
        "Chạy demo",
        "Chạy lại",
        "Thêm Fe3+",
        "Thêm SCN-",
        "Thêm nước",
        "Đến lúc trộn",
        "Đến kết quả"
      ]
    }
  },
  "created_at": "2026-06-19T20:32:52Z"
}
