{
  "schema_version": "chem-lab.verification-result.v2",
  "artifact_type": "verification_result",
  "slug": "lab-ngon-lua-kim-loai",
  "html_file": "/home/ding/debug_mc/material_creator/skills_material_K12/skills/chemistry-experiment-lab/outputs/lab-ngon-lua-kim-loai.html",
  "final_status": "pass",
  "blockers": [],
  "warnings": [],
  "verification": {
    "environment": {
      "browser": "chromium",
      "headless": true,
      "os": "linux",
      "viewport": "desktop-1280x800 + mobile-iPhone13"
    },
    "webgl": {
      "supported": true,
      "renderer_type": "ANGLE (Google, Vulkan 1.3.0 (SwiftShader Device (Subzero) (0x0000C0DE)), SwiftShader driver)",
      "fallback_used": true
    },
    "invariants": {
      "stage_present": true,
      "stage_dominance_pass": true,
      "autoplay_or_primary_run_pass": true,
      "mobile_fit_pass": true,
      "fallback_present": false
    }
  },
  "artifacts": {
    "desktop_screenshot": "/home/ding/debug_mc/material_creator/skills_material_K12/skills/chemistry-experiment-lab/evaluations/artifacts/lab-ngon-lua-kim-loai/2026-06-20T12-37-40Z/desktop.png",
    "mobile_screenshot": "/home/ding/debug_mc/material_creator/skills_material_K12/skills/chemistry-experiment-lab/evaluations/artifacts/lab-ngon-lua-kim-loai/2026-06-20T12-37-40Z/mobile.png",
    "trace": "/home/ding/debug_mc/material_creator/skills_material_K12/skills/chemistry-experiment-lab/evaluations/artifacts/lab-ngon-lua-kim-loai/2026-06-20T12-37-40Z"
  },
  "checks": {
    "desktop": {
      "title": "Thử màu ngọn lửa của ion kim loại",
      "stagePresent": true,
      "stageAreaRatio": 1.300690233707428,
      "scrollWidth": 1280,
      "innerWidth": 1280,
      "fallbackPresent": false,
      "primaryRunControlPresent": true,
      "buttonTexts": [
        "Li+",
        "Na+",
        "K+",
        "Ca2+",
        "Cu2+",
        "Xem mẫu",
        "Đỏ carmine",
        "Vàng mạnh",
        "Tím lilac",
        "Đỏ gạch",
        "Xanh lục",
        "Xem mẫu",
        "Đỏ carmine",
        "Vàng mạnh",
        "Tím lilac",
        "Đỏ gạch",
        "Xanh lục",
        "Xem mẫu",
        "Đỏ carmine",
        "Vàng mạnh",
        "Tím lilac",
        "Đỏ gạch",
        "Xanh lục",
        "Xem mẫu",
        "Đỏ carmine",
        "Vàng mạnh",
        "Tím lilac",
        "Đỏ gạch",
        "Xanh lục",
        "Xem mẫu",
        "Đỏ carmine",
        "Vàng mạnh",
        "Tím lilac",
        "Đỏ gạch",
        "Xanh lục",
        "Quan sát khay lửa",
        "Tạm dừng",
        "Làm lại"
      ]
    },
    "mobile": {
      "title": "Thử màu ngọn lửa của ion kim loại",
      "stagePresent": true,
      "stageAreaRatio": 0.6999073215940685,
      "scrollWidth": 390,
      "innerWidth": 390,
      "fallbackPresent": false,
      "primaryRunControlPresent": true,
      "buttonTexts": [
        "Li+",
        "Na+",
        "K+",
        "Ca2+",
        "Cu2+",
        "Xem mẫu",
        "Đỏ carmine",
        "Vàng mạnh",
        "Tím lilac",
        "Đỏ gạch",
        "Xanh lục",
        "Xem mẫu",
        "Đỏ carmine",
        "Vàng mạnh",
        "Tím lilac",
        "Đỏ gạch",
        "Xanh lục",
        "Xem mẫu",
        "Đỏ carmine",
        "Vàng mạnh",
        "Tím lilac",
        "Đỏ gạch",
        "Xanh lục",
        "Xem mẫu",
        "Đỏ carmine",
        "Vàng mạnh",
        "Tím lilac",
        "Đỏ gạch",
        "Xanh lục",
        "Xem mẫu",
        "Đỏ carmine",
        "Vàng mạnh",
        "Tím lilac",
        "Đỏ gạch",
        "Xanh lục",
        "Quan sát khay lửa",
        "Tạm dừng",
        "Làm lại"
      ]
    }
  },
  "created_at": "2026-06-20T12:37:53.797Z"
}